{
  "key": "threatening",
  "name": "Threatening",
  "abilityScoreIncreases": [
    "charisma"
  ],
  "description": "You become fearsome to others, gaining the following benefits:\n- Increase your Charisma score by 1, to a maximum of 20.\n- You gain proficiency in the Intimidation skill. If you are already proficient in it, you instead gain expertise in it.\n- When you take the Attack action, you can replace one attack with an attempt to demoralize one humanoid you can see within 30 feet of you that can see and hear you. Make a Charisma (Intimidation) check contested by the target's Wisdom (Insight) check. If your check succeeds, the target is frightened until the end of your next turn. If your check fails, the target can't be frightened by you in this way for 1 hour.",
  "sourceKey": "phb",
  "contentSet": "core"
}
